{
  "$schema": "http://json-schema.org/draft-03/schema",
  "required": false,
  "type": "array",
  "items": {
    "required": false,
    "type": "object",
    "properties": {
      "AdministrativeArea": {
        "required": false,
        "type": "object",
        "properties": {
          "ID": {
            "required": false,
            "type": "string"
          },
          "LocalizedName": {
            "required": false,
            "type": "string"
          },
          "EnglishName": {
            "required": false,
            "type": "string"
          },
          "Level": {
            "required": false,
            "type": "integer"
          },
          "LocalizedType": {
            "required": false,
            "type": "string"
          },
          "EnglishType": {
            "required": false,
            "type": "string"
          },
          "CountryID": {
            "required": false,
            "type": "string"
          }
        }
      },
      "Country": {
        "required": false,
        "type": "object",
        "properties": {
          "ID": {
            "required": false,
            "type": "string"
          },
          "LocalizedName": {
            "required": false,
            "type": "string"
          },
          "EnglishName": {
            "required": false,
            "type": "string"
          }
        }
      },
      "Details": {
        "required": false,
        "type": "object",
        "properties": {
          "Key": {
            "required": false,
            "type": "string"
          },
          "StationCode": {
            "required": false,
            "type": "string"
          },
          "StationGmtOffset": {
            "required": false,
            "type": "integer"
          },
          "BandMap": {
            "required": false,
            "type": "string"
          },
          "Climo": {
            "required": false,
            "type": "string"
          },
          "LocalRadar": {
            "required": false,
            "type": "string"
          },
          "MediaRegion": {
            "required": false,
            "type": "null"
          },
          "Metar": {
            "required": false,
            "type": "string"
          },
          "NXMetro": {
            "required": false,
            "type": "string"
          },
          "NXState": {
            "required": false,
            "type": "string"
          },
          "Population": {
            "required": false,
            "type": "integer"
          },
          "PrimaryWarningCountyCode": {
            "required": false,
            "type": "string"
          },
          "PrimaryWarningZoneCode": {
            "required": false,
            "type": "string"
          },
          "Satellite": {
            "required": false,
            "type": "string"
          },
          "Synoptic": {
            "required": false,
            "type": "string"
          },
          "MarineStation": {
            "required": false,
            "type": "string"
          },
          "MarineStationGMTOffset": {
            "required": false,
            "type": "null"
          },
          "VideoCode": {
            "required": false,
            "type": "string"
          }
        }
      },
      "EnglishName": {
        "required": false,
        "type": "string"
      },
      "GeoPosition": {
        "required": false,
        "type": "object",
        "properties": {
          "Latitude": {
            "required": false,
            "type": "number"
          },
          "Longitude": {
            "required": false,
            "type": "number"
          },
          "Elevation": {
            "required": false,
            "type": "object",
            "properties": {
              "Metric": {
                "required": false,
                "type": "object",
                "properties": {
                  "Value": {
                    "required": false,
                    "type": "string"
                  },
                  "Unit": {
                    "required": false,
                    "type": "string"
                  },
                  "UnitType": {
                    "required": false,
                    "type": "integer"
                  }
                }
              },
              "Imperial": {
                "required": false,
                "type": "object",
                "properties": {
                  "Value": {
                    "required": false,
                    "type": "string"
                  },
                  "Unit": {
                    "required": false,
                    "type": "string"
                  },
                  "UnitType": {
                    "required": false,
                    "type": "integer"
                  }
                }
              }
            }
          }
        }
      },
      "IsAlias": {
        "required": false,
        "type": "boolean"
      },
      "Key": {
        "required": false,
        "type": "string"
      },
      "LocalizedName": {
        "required": false,
        "type": "string"
      },
      "PrimaryPostalCode": {
        "required": false,
        "type": "string"
      },
      "Rank": {
        "required": false,
        "type": "integer"
      },
      "Region": {
        "required": false,
        "type": "object",
        "properties": {
          "ID": {
            "required": false,
            "type": "string"
          },
          "LocalizedName": {
            "required": false,
            "type": "string"
          },
          "EnglishName": {
            "required": false,
            "type": "string"
          }
        }
      },
      "SupplementalAdminAreas": {
        "required": false,
        "type": "array"
      },
      "TimeZone": {
        "required": false,
        "type": "object",
        "properties": {
          "Code": {
            "required": false,
            "type": "string"
          },
          "Name": {
            "required": false,
            "type": "string"
          },
          "GmtOffset": {
            "required": false,
            "type": "integer"
          },
          "IsDaylightSaving": {
            "required": false,
            "type": "boolean"
          },
          "NextOffsetChange": {
            "required": false,
            "type": "null"
          }
        }
      },
      "Type": {
        "required": false,
        "type": "string"
      },
      "Version": {
        "required": false,
        "type": "integer"
      }
    }
  }
}